STT,Question,Answer
1,"Bạn có thể mô tả kinh nghiệm với các phương pháp nghiên cứu người dùng như phỏng vấn, khảo sát, kiểm tra tính khả dụng và sắp xếp thẻ không?","Tôi đã sử dụng nhiều phương pháp nghiên cứu người dùng. Phỏng vấn một-một giúp hiểu sâu nhu cầu và điểm đau. Khảo sát thu thập dữ liệu định lượng từ mẫu lớn, xác định xu hướng. Kiểm tra tính khả dụng đánh giá tương tác sản phẩm, tìm khu vực cần cải thiện. Sắp xếp thẻ hỗ trợ thiết kế kiến trúc thông tin, đảm bảo điều hướng trực quan. Tôi chọn phương pháp phù hợp mục tiêu dự án, thường kết hợp để có cái nhìn toàn diện."
2,Làm thế nào để xác định phương pháp nghiên cứu phù hợp nhất cho dự án?,"Tôi xem xét mục tiêu nghiên cứu: khám phá, mô tả hay đánh giá. Phỏng vấn, nhóm tập trung phù hợp cho khám phá nhu cầu. Khảo sát, kiểm tra A/B tốt cho đánh giá sản phẩm. Phương pháp được chọn phải phù hợp mục tiêu và cung cấp dữ liệu hành động, đôi khi kết hợp nhiều phương pháp."
3,Các bước nào để đảm bảo kết quả nghiên cứu không thiên vị và đáng tin cậy?,"Tôi thiết kế phương pháp cẩn thận, chọn nhóm người tham gia đa dạng, đặt câu hỏi không thiên vị. Thu thập dữ liệu khách quan, tránh dẫn dắt. Sử dụng nhiều phương pháp để xác nhận kết quả. Phân tích cùng đội nhóm để giảm chủ quan, đảm bảo kết luận chính xác."
4,Mô tả lần bạn điều chỉnh cách tiếp cận nghiên cứu do thách thức không lường trước.,"Trong dự án cải thiện trang web thương mại điện tử, tôi dự định kiểm tra tính khả dụng trực tiếp nhưng gặp hạn chế di chuyển. Tôi chuyển sang kiểm tra từ xa qua video và chia sẻ màn hình, điều chỉnh logistics để thu thập dữ liệu hiệu quả, đảm bảo an toàn và thành công."
5,Làm thế nào để ưu tiên câu hỏi nghiên cứu trong dự án hạn chế nguồn lực hoặc thời gian?,"Tôi hợp tác với bên liên quan để xác định mục tiêu chính. Ưu tiên câu hỏi có tác động cao, khả thi trong ràng buộc. Câu hỏi ít quan trọng được hoãn hoặc dùng phương pháp thay thế. Giao tiếp liên tục với đội đảm bảo tiến độ và phù hợp yêu cầu."
6,Ví dụ về việc sử dụng dữ liệu định lượng trong nghiên cứu người dùng?,"Trong dự án trang web thương mại điện tử, Google Analytics cho thấy tỷ lệ thoát cao và chuyển đổi thấp. Tôi thực hiện kiểm tra tính khả dụng và phỏng vấn, phát hiện vấn đề điều hướng và mô tả sản phẩm. Cải thiện thiết kế dựa trên dữ liệu này tăng chuyển đổi, giảm tỷ lệ thoát."
7,Xử lý khi bên liên quan không đồng ý với kết quả nghiên cứu?,"Tôi trình bày rõ phương pháp và lý do kết luận, dùng dữ liệu minh bạch. Nếu bất đồng, tôi thảo luận để hiểu lo ngại, có thể nghiên cứu thêm. Hợp tác để tìm giải pháp, đảm bảo cải thiện trải nghiệm người dùng và đạt mục tiêu kinh doanh."
8,Công cụ và phần mềm nào bạn dùng để nghiên cứu và phân tích kết quả?,"Tôi dùng UserTesting, Lookback cho kiểm tra tính khả dụng từ xa, SurveyMonkey, Google Forms cho khảo sát. Phân tích định tính với Reframer của Optimal Workshop để tổng hợp dữ liệu phỏng vấn, nhóm tập trung, giúp đưa ra quyết định thiết kế hiệu quả."
9,Quy trình tuyển dụng người tham gia cho nghiên cứu người dùng?,"Tôi xác định đối tượng mục tiêu (nhân khẩu học, tâm lý học). Tuyển qua cơ sở dữ liệu khách hàng, mạng xã hội, hoặc cơ quan chuyên biệt. Sàng lọc bằng bảng câu hỏi/phỏng vấn, chọn người phù hợp. Thông báo chi tiết nghiên cứu, đảm bảo họ tham gia tích cực."
10,Làm thế nào đảm bảo quyền riêng tư và đạo đức trong nghiên cứu người dùng?,"Tôi lấy sự đồng ý có thông tin, giải thích mục đích và bảo vệ dữ liệu. Ẩn danh dữ liệu, dùng mã hóa lưu trữ, giới hạn truy cập. Tuân thủ GDPR, cho phép người tham gia rút lui bất cứ lúc nào, đảm bảo nghiên cứu đạo đức và tôn trọng quyền riêng tư."
12,Bạn đã thực hiện nghiên cứu người dùng từ xa chưa? Thách thức và cách vượt qua?,"Có, tôi thực hiện nghiên cứu từ xa trong đại dịch. Thách thức là giao tiếp và vấn đề kỹ thuật. Tôi dùng hướng dẫn rõ ràng, kiểm tra công cụ trước, chuẩn bị nền tảng dự phòng. Điều này đảm bảo chất lượng dữ liệu và trải nghiệm người tham gia."
13,Tình huống kết quả nghiên cứu cải thiện đáng kể sản phẩm/dịch vụ?,"Trong dự án thiết kế lại ứng dụng di động, phỏng vấn và kiểm tra tính khả dụng cho thấy menu điều hướng không trực quan. Tôi hợp tác với đội thiết kế để tái cấu trúc, thêm dấu hiệu hình ảnh. Kiểm tra sau cải thiện cho thấy tăng hài lòng và tỷ lệ hoàn thành nhiệm vụ."
14,Làm thế nào trình bày kết quả nghiên cứu cho bên liên quan không kỹ thuật?,"Tôi chọn cái nhìn chính liên quan đến mục tiêu của họ, dùng ngôn ngữ đơn giản, tránh thuật ngữ. Sử dụng biểu đồ, đồ thị và câu chuyện người dùng để minh họa. Khuyến khích câu hỏi, đảm bảo họ hiểu và áp dụng kết quả vào quyết định."
15,Vai trò của sự đồng cảm trong nghiên cứu người dùng?,"Sự đồng cảm giúp tôi hiểu nhu cầu, động lực và điểm đau của người dùng. Khi phỏng vấn hoặc quan sát, tôi đặt mình vào vị trí họ để khám phá rào cản. Trình bày câu chuyện người dùng giúp đội thiết kế ưu tiên cải thiện, tạo sản phẩm phù hợp."
16,Làm thế nào cập nhật xu hướng và thực hành tốt nhất trong nghiên cứu người dùng?,"Tôi theo dõi blog ngành, tham gia hội thảo, hội nghị và khóa học trực tuyến. Thực hành qua các dự án giúp tôi áp dụng kỹ thuật mới, đảm bảo nghiên cứu luôn hiện đại và hiệu quả."
17,"Kinh nghiệm làm việc với đội đa chức năng (nhà thiết kế, nhà phát triển, quản lý sản phẩm)?","Tôi hợp tác với đội đa chức năng trong dự án thiết kế lại ứng dụng. Thực hiện kiểm tra tính khả dụng, chia sẻ dữ liệu với nhà thiết kế để tạo nguyên mẫu, họp với nhà phát triển và quản lý sản phẩm để đảm bảo tính khả thi. Giao tiếp rõ ràng giúp tạo giải pháp tập trung vào người dùng."
18,Làm thế nào cân bằng yêu cầu xung đột của bên liên quan trong dự án nghiên cứu?,"Trong dự án trang web thương mại điện tử, marketing muốn tăng tương tác, sản phẩm muốn cải thiện điều hướng. Tôi họp để hiểu mục tiêu, dùng kiểm tra tính khả dụng, khảo sát và phỏng vấn. Đề xuất tích hợp khuyến nghị cá nhân hóa và tinh gọn điều hướng, cân bằng lợi ích cả hai bên."
19,Làm thế nào đo lường sự thành công của nghiên cứu người dùng?,"Tôi đánh giá quy trình qua tỷ lệ tham gia và chất lượng phản hồi. Kết quả đo bằng tác động lên sản phẩm: cải thiện thiết kế, tăng hài lòng, tỷ lệ hoàn thành nhiệm vụ và chỉ số sử dụng. Phản hồi tích cực từ người dùng cuối xác nhận thành công."
20,Chiến lược khuyến khích giao tiếp mở và hợp tác trong đội?,"Tôi tạo văn hóa tin tưởng, tổ chức kiểm tra và hồi tưởng để chia sẻ ý kiến. Thúc đẩy lắng nghe tích cực, hỏi làm rõ, đảm bảo mọi quan điểm được xem xét, dẫn đến hợp tác hiệu quả và quyết định tốt hơn."
21,Nghiên cứu cho đối tượng quốc tế? Thách thức và cách vượt qua?,"Có, tôi nghiên cứu cho ứng dụng di động quốc tế. Thách thức là ngôn ngữ, văn hóa và múi giờ. Hợp tác với nhà nghiên cứu địa phương, dùng lịch trình linh hoạt và công cụ video, đảm bảo dữ liệu phù hợp với nhu cầu đa dạng của người dùng."
22,Kinh nghiệm với tính khả tiếp cận và thiết kế bao gồm?,"Trong dự án nền tảng học trực tuyến, tôi nghiên cứu WCAG 2.1, tuyển người tham gia đa dạng, dùng công nghệ hỗ trợ (trình đọc màn hình). Cải thiện độ tương phản, văn bản thay thế và điều hướng, tạo sản phẩm khả tiếp cận cho mọi người dùng."
23,Xử lý phản hồi tiêu cực từ người tham gia trong kiểm tra tính khả dụng?,"Tôi xem phản hồi tiêu cực là cơ hội cải thiện, lắng nghe tích cực, hỏi chi tiết để hiểu nguyên nhân. Phân tích cùng dữ liệu khác để ưu tiên cải thiện, tạo môi trường thoải mái và đảm bảo dữ liệu chính xác."
24,Ví dụ sử dụng dữ liệu định tính trong nghiên cứu người dùng?,"Trong dự án trang web thương mại điện tử, phỏng vấn định tính cho thấy khó khăn trong điều hướng và vận chuyển. Cải thiện cấu trúc điều hướng, lọc sản phẩm và thông tin vận chuyển, giảm tỷ lệ thoát, tăng chuyển đổi."
25,Cách tiếp cận phân tích cạnh tranh trong nghiên cứu người dùng?,"Tôi xác định đối thủ, so sánh tính khả dụng, chức năng, thẩm mỹ. Thu thập dữ liệu qua trang web, đánh giá, nghiên cứu trường hợp. Tổng hợp vào báo cáo với khuyến nghị, giúp định vị sản phẩm hiệu quả trên thị trường."
26,Từng thay đổi trọng tâm nghiên cứu do kết quả bất ngờ?,"Trong dự án cải thiện thanh toán trang web thương mại điện tử, phát hiện vấn đề điều hướng qua kiểm tra tính khả dụng. Chuyển trọng tâm, thêm sắp xếp thẻ và kiểm tra cây, cải thiện cả thanh toán và khám phá sản phẩm, tăng hài lòng và giảm bỏ giỏ hàng."
27,Làm thế nào đảm bảo cái nhìn nghiên cứu có thể hành động và liên quan?,"Tôi phù hợp mục tiêu nghiên cứu với dự án, tổng hợp dữ liệu thành kết quả rõ ràng, ưu tiên tác động cao. Đưa khuyến nghị cụ thể, giao tiếp liên tục với đội để đảm bảo kết quả phù hợp và hỗ trợ cải thiện sản phẩm."
28,Lần bạn ủng hộ tầm quan trọng của nghiên cứu người dùng?,"Trong dự án thiết kế lại ứng dụng, tôi thuyết phục quản lý bằng rủi ro không nghiên cứu (chi phí làm lại, hài lòng thấp). Dẫn ví dụ thành công, dẫn đến phân bổ nguồn lực, cải thiện trải nghiệm và tỷ lệ áp dụng qua phỏng vấn và kiểm tra."
29,Vai trò nghiên cứu người dùng trong vòng đời phát triển sản phẩm?,"Nghiên cứu người dùng đảm bảo sản phẩm tập trung vào người dùng từ khái niệm đến sau ra mắt. Xác định nhu cầu, xác nhận thiết kế, cải thiện liên tục qua phỏng vấn, kiểm tra tính khả dụng, khảo sát, dẫn đến hài lòng cao và kết quả kinh doanh tốt."
30,Cân bằng nghiên cứu kỹ lưỡng với phát triển agile nhanh chóng?,"Tôi ưu tiên câu hỏi quan trọng, dùng phương pháp lean như kiểm tra nhanh, khảo sát ngắn. Hợp tác liên tục, chia sẻ dữ liệu sớm, lặp lại thiết kế, đảm bảo cái nhìn kịp thời và phù hợp trong môi trường agile."
